{
  "$schema": "behavior-manifest.schema.json",
  "schemaVersion": 1,
  "authority": "hosted_copilot/docs/HOSTED_COPILOT_CODE_REVIEW_IMPLEMENTATION.md",
  "targetHarness": "playwright",
  "behaviors": [
    {
      "id": "WB-UX-TREE-001",
      "title": "Untouched candidate identities remain neutral",
      "journey": "playwright/journeys/candidate-decorations.journey.cjs"
    },
    {
      "id": "WB-UX-TREE-002",
      "title": "Selected needs-input state propagates to ancestors",
      "journey": "playwright/journeys/candidate-decorations.journey.cjs"
    },
    {
      "id": "WB-UX-TREE-003",
      "title": "Completed selection propagates ready state",
      "journey": "playwright/journeys/candidate-decorations.journey.cjs"
    },
    {
      "id": "WB-UX-TREE-004",
      "title": "Trailing decorations preserve capped tree geometry and collapsed status",
      "journey": "playwright/journeys/candidate-decorations.journey.cjs"
    },
    {
      "id": "WB-UX-TREE-005",
      "title": "Overrides root and leaf share aggregate readiness decoration",
      "journey": "playwright/journeys/candidate-decorations.journey.cjs"
    },
    {
      "id": "WB-UX-TREE-006",
      "title": "Contested status pills remain centered text while sort headers retain chevrons",
      "journey": "playwright/journeys/candidate-decorations.journey.cjs"
    },
    {
      "id": "WB-UX-TREE-007",
      "title": "Assessment categories truncate to one line with delayed full-text tooltips",
      "journey": "playwright/journeys/candidate-decorations.journey.cjs"
    },
    {
      "id": "WB-UX-TREE-008",
      "title": "Contested status routes directly to Maintainer Override details",
      "journey": "playwright/journeys/candidate-decorations.journey.cjs"
    },
    {
      "id": "WB-UX-TREE-009",
      "title": "Assessment Details distinguishes original override inclusion and catalog states",
      "journey": "playwright/journeys/candidate-decorations.journey.cjs"
    },
    {
      "id": "WB-UX-TREE-010",
      "title": "Cold sprite loading paints persisted root decorations before folder expansion",
      "journey": "playwright/journeys/assessment-review-lifecycle.journey.cjs"
    },
    {
      "id": "WB-UX-PREVIEW-001",
      "title": "Promotion Preview renders all review artifacts in one continuous changed-file document",
      "journey": "playwright/journeys/promotion-preview-review.journey.cjs"
    },
    {
      "id": "WB-UX-PREVIEW-002",
      "title": "Non-empty review artifact folders start expanded, empty scopes remain absent, and disclosure stays independent from file navigation",
      "journey": "playwright/journeys/promotion-preview-review.journey.cjs"
    },
    {
      "id": "WB-UX-PREVIEW-003",
      "title": "Split files use authenticated headers, status-aware tree icons, independent Viewed state, and uniform spacing",
      "journey": "playwright/journeys/promotion-preview-review.journey.cjs"
    },
    {
      "id": "WB-UX-PREVIEW-004",
      "title": "Raw approved rules remain one contextual full-file diff with exact expansion controls",
      "journey": "playwright/journeys/promotion-preview-review.journey.cjs"
    },
    {
      "id": "WB-UX-PREVIEW-005",
      "title": "Review approval remains accessible across responsive continuous-file layouts",
      "journey": "playwright/journeys/promotion-preview-review.journey.cjs"
    },
    {
      "id": "WB-UX-PREVIEW-006",
      "title": "Review toolbar, tree, and diff scroller retain independent layer ownership",
      "journey": "playwright/journeys/promotion-preview-review.journey.cjs"
    },
    {
      "id": "WB-UX-PREVIEW-007",
      "title": "Each file card owns a sticky header wrapper and sibling diff body",
      "journey": "playwright/journeys/promotion-preview-review.journey.cjs"
    },
    {
      "id": "WB-UX-PREVIEW-008",
      "title": "Changed-file tree exposes an accessible draggable splitter",
      "journey": "playwright/journeys/promotion-preview-review.journey.cjs"
    },
    {
      "id": "WB-UX-PREVIEW-009",
      "title": "File headers expose virtual artifact paths without changing navigation identity",
      "journey": "playwright/journeys/promotion-preview-review.journey.cjs"
    },
    {
      "id": "WB-UX-PREVIEW-010",
      "title": "Changed-file summary pairs colored totals with a five-cell diffstat",
      "journey": "playwright/journeys/promotion-preview-review.journey.cjs"
    },
    {
      "id": "WB-UX-PREVIEW-011",
      "title": "File-level line expansion remains reversible after any inline context expansion",
      "journey": "playwright/journeys/promotion-preview-review.journey.cjs"
    },
    {
      "id": "WB-UX-PREVIEW-012",
      "title": "Changed-file tree navigation preserves chevron-owned file-card disclosure state",
      "journey": "playwright/journeys/promotion-preview-review.journey.cjs"
    },
    {
      "id": "WB-UX-PREVIEW-013",
      "title": "Large reviews virtualize off-screen diff bodies while preserving navigation and scroll geometry",
      "journey": "playwright/journeys/promotion-preview-review.journey.cjs"
    },
    {
      "id": "WB-UX-PREVIEW-014",
      "title": "Open Rule Issues block promotion approval with stable status geometry and an explicit requirement",
      "journey": "playwright/journeys/promotion-preview-review.journey.cjs"
    },
    {
      "id": "WB-UX-STICKY-001",
      "title": "Candidate tree preserves sticky source category and column context",
      "journey": "playwright/journeys/candidate-sticky-context.journey.cjs"
    },
    {
      "id": "WB-UX-STICKY-002",
      "title": "Collapsed candidate branches do not paint stale sticky content",
      "journey": "playwright/journeys/candidate-sticky-context.journey.cjs"
    },
    {
      "id": "WB-UX-STICKY-003",
      "title": "Candidate rows settle below stable sticky ancestry",
      "journey": "playwright/journeys/candidate-sticky-context.journey.cjs"
    },
    {
      "id": "WB-UX-STICKY-004",
      "title": "Candidate sorting preserves tree position and disclosure state",
      "journey": "playwright/journeys/candidate-sticky-context.journey.cjs"
    },
    {
      "id": "WB-UX-STICKY-005",
      "title": "Static candidate headers mirror folder disclosure state",
      "journey": "playwright/journeys/candidate-sticky-context.journey.cjs"
    },
    {
      "id": "WB-UX-STICKY-006",
      "title": "Sibling folder expansion preserves tree position",
      "journey": "playwright/journeys/candidate-sticky-context.journey.cjs"
    },
    {
      "id": "WB-UX-STICKY-007",
      "title": "Candidate hierarchy rows and terminal scrolling stay on a 40px grid",
      "journey": "playwright/journeys/candidate-sticky-context.journey.cjs"
    },
    {
      "id": "WB-UX-STICKY-008",
      "title": "Coarse wheel input preserves speed on a grid-aligned destination",
      "journey": "playwright/journeys/candidate-sticky-context.journey.cjs"
    },
    {
      "id": "WB-UX-STICKY-009",
      "title": "Assessment Results preserves contained 40px leaves through sorting",
      "journey": "playwright/journeys/candidate-sticky-context.journey.cjs"
    },
    {
      "id": "WB-UX-STICKY-010",
      "title": "Sticky child handoffs reuse a bounded prewarmed renderer pool",
      "journey": "playwright/journeys/candidate-sticky-context.journey.cjs"
    },
    {
      "id": "WB-UX-STICKY-011",
      "title": "Candidate Sources parents start collapsed including Overrides",
      "journey": "playwright/journeys/candidate-sticky-context.journey.cjs"
    },
    {
      "id": "WB-UX-PROTECTED-001",
      "title": "Protected rules render as locked immutable rows under Overrides",
      "journey": "playwright/journeys/protected-rules.journey.cjs"
    },
    {
      "id": "WB-UX-PROTECTED-002",
      "title": "Protected rule details remain read-only and preserve catalog definitions",
      "journey": "playwright/journeys/protected-rules.journey.cjs"
    },
    {
      "id": "WB-UX-PROTECTED-003",
      "title": "Protected rules coexist with applicability overrides in the existing sticky hierarchy",
      "journey": "playwright/journeys/protected-rules.journey.cjs"
    },
    {
      "id": "WB-UX-PROVENANCE-001",
      "title": "Contributor provenance tooltip retains concise complete text",
      "journey": "playwright/journeys/provenance-tooltip.journey.cjs"
    },
    {
      "id": "WB-UX-PROVENANCE-002",
      "title": "Contributor provenance tooltip anchors and clamps inside the viewport",
      "journey": "playwright/journeys/provenance-tooltip.journey.cjs"
    },
    {
      "id": "WB-UX-CONTRIBUTOR-001",
      "title": "Contributor documents are non-actionable candidate parents",
      "journey": "playwright/journeys/contributor-rule-candidates.journey.cjs"
    },
    {
      "id": "WB-UX-CONTRIBUTOR-002",
      "title": "Contributor document requirements are independent rule candidates",
      "journey": "playwright/journeys/contributor-rule-candidates.journey.cjs"
    },
    {
      "id": "WB-UX-CONTRIBUTOR-003",
      "title": "Update preview and payload use one semantic Hosted target",
      "journey": "playwright/journeys/contributor-rule-candidates.journey.cjs"
    },
    {
      "id": "WB-UX-IDENTITY-001",
      "title": "Add candidates retain one proposed Hosted rule identity across views and exports",
      "journey": "playwright/journeys/contributor-rule-candidates.journey.cjs"
    },
    {
      "id": "WB-UX-IDENTITY-002",
      "title": "Trusted display construction assigns collision-free identities before Workbench load",
      "journey": "playwright/journeys/contributor-rule-candidates.journey.cjs"
    },
    {
      "id": "WB-UX-IDENTITY-003",
      "title": "Rule Actions exposes generated identity without an editable ID control",
      "journey": "playwright/journeys/contributor-rule-candidates.journey.cjs"
    },
    {
      "id": "WB-UX-IDENTITY-004",
      "title": "Mapped candidates expose and export their resulting Hosted identity",